{"schemaVersion":"yutu-graph@1","graphId":"review-loop","graphVersion":"1.0.0","projectId":"控制台","objectiveRef":"artifact://shared/routing/flows/review-loop.yaml","sourceSha256":"eab6a1b17ad1fe5f04a65d67f6a879efe2892038678ac481598e754cc0b74613","startNode":"implement","nodes":[{"id":"done","type":"end","agentRole":"","timeoutMs":0},{"id":"human","type":"human_gate","agentRole":"","timeoutMs":0},{"id":"implement","type":"agent","agentRole":"worker_code","timeoutMs":0},{"id":"review","type":"agent","agentRole":"supervisor","timeoutMs":0}],"edges":[{"from":"human","to":"done","when":"{{ human.decision == 'approve' }}","reasonCode":"flow_route","delivery":"single"},{"from":"human","to":"implement","when":"{{ human.decision == 'revise' }}","reasonCode":"flow_route","delivery":"single"},{"from":"implement","to":"review","when":"","reasonCode":"flow_route","delivery":"single"},{"from":"review","to":"done","when":"{{ review.routing == 'approve' and review.pass == true }}","reasonCode":"flow_route","delivery":"single"},{"from":"review","to":"human","when":"{{ review.routing == 'manual_review' or review.routing == 'loop_limit' }}","reasonCode":"flow_route","delivery":"single"},{"from":"review","to":"implement","when":"{{ review.routing == 'rework' and review.pass == false and loop < max_loops }}","reasonCode":"flow_route","delivery":"single"}],"budgets":{"maxLoops":3,"wallTimeoutMs":7200000,"maxInputBytes":1048576,"maxManifestBytes":1048576,"maxMemoryBytes":8388608},"policies":{"acceptanceRequired":true,"shadowOnly":true,"defaultEnabled":false,"onNoEdge":"planner","unsupportedRuntimeTypes":["fanout","join","subgraph"]},"manifestHash":"b3a5da2e862d04c2a42c9c50a23d7d98c5c6e42e5022477d6e5c9d5b6d04a820"}
